{
  "$schema": "http://json-schema.org/draft-07/schema#",
  "$id": "schema-modelica.json",
  "type": "array",
  "title": "JSON parsed Modelica file",
  "description": "Json representation of a Modelica model",
  "definitions": {
    "ModelicaBlock": {
      "description": "Info of a modelica block: model, parameter, input or output",
      "type": "array",
      "items": {
        "type": "object",
        "required": [
          "className",
          "name"
        ],
        "properties": {
          "className": {
            "description": "Name of the class: no special characters or spaces",
            "type": "string",
            "pattern": "^([a-zA-Z0-9._*]*)$"
          },
          "name": {
            "description": "Name of the block: no special characters or spaces",
            "type": "string",
            "pattern": "^([a-zA-Z0-9._*]*)$"
          },
          "comment": {
            "description": "comment on the block: no special characters or spaces",
            "type": "string"
          },
          "value": {
            "description": "value of the block, if applicable",
            "type": "string"
          },
          "annotation": {
            "type": "object",
            "required": [
              "dialog"
            ],
            "properties": {
              "dialog": {
                "type": "object",
                "properties": {
                  "tab": {
                    "type": "string",
                    "examples": [
                      "General"
                    ]
                  },
                  "group": {
                    "type": "string",
                    "examples": [
                      "Parameters"
                    ]
                  }
                }
              }
            }
          },
          "modifications": {
            "type": "array",
            "items": {
              "type": "object",
              "properties": {
                "value": {
                  "type": "string"
                },
                "isFinal": {
                  "type": "boolean"
                }
              }
            }
          },
          "placement": {
            "type": "object",
            "properties": {
              "transformation": {
                "type": "object",
                "properties": {
                  "extent": {
                    "$ref": "#/definitions/coordinates"
                  }
                }
              }
            }
          }
        }
      }
    },
    "coordinates": {
      "description": "Coordinates on a 2d plan",
      "type": "array",
      "items": {
        "type": "object",
        "required": [
          "x1",
          "x2"
        ],
        "properties": {
          "x1": {
            "type": "number"
          },
          "x2": {
            "type": "number"
          }
        }
      }
    },
    "color": {
      "description": "RGB colors",
      "type": "object",
      "required": [
        "r",
        "g",
        "b"
      ],
      "properties": {
        "r": {
          "type": "number",
          "minimum": 0,
          "maximum": 255
        },
        "g": {
          "type": "number",
          "minimum": 0,
          "maximum": 255
        },
        "b": {
          "type": "number",
          "minimum": 0,
          "maximum": 255
        }
      }
    }
  },
  "items": {
    "type": "object",
    "required": [
      "modelicaFile",
      "topClassName"
    ],
    "properties": {
      "modelicaFile": {
        "decription": "Name of the Modelica file. Ends with '.mo'",
        "type": "string",
        "pattern": ".*.(mo|MO)"
      },
      "within": {
        "description": "Within statement from the Modelica file : no special characters or spaces",
        "type": "string",
        "pattern": "^([a-zA-Z0-9._*]*)$"
      },
      "topClassName": {
        "description": "Name of the top class of the Modelica model: no special characters or spaces ",
        "type": "string",
        "pattern": "^([a-zA-Z0-9._*]*)$"
      },
      "comment": {
        "description": "Comment on the model",
        "type": "string"
      },
      "public": {
        "type": "object",
        "description": "Public part of the modelica file",
        "properties": {
          "parameters": {
            "$ref": "#/definitions/ModelicaBlock"
          },
          "models": {
            "$ref": "#/definitions/ModelicaBlock"
          },
          "inputs": {
            "$ref": "#/definitions/ModelicaBlock"
          },
          "outputs": {
            "$ref": "#/definitions/ModelicaBlock"
          }
        }
      },
      "protected": {
        "type": "object",
        "description": "Protected part of the modelica file",
        "properties": {
          "parameters": {
            "$ref": "#/definitions/ModelicaBlock"
          },
          "models": {
            "$ref": "#/definitions/ModelicaBlock"
          }
        }
      },
      "connections": {
        "type": "array",
        "items": {
          "type": "array",
          "items": {
            "type": "object",
            "properties": {
              "instance": {
                "type": "string"
              },
              "connector": {
                "type": "string"
              },
              "points": {
                "$ref": "#/definitions/coordinates"
              },
              "color": {
                "$ref": "#/definitions/color"
              }
            }
          }
        }
      },
      "info": {
        "description": "Informations of the model must be in html format",
        "type": "string",
        "pattern": "^(<(html|HTML)>)(.|\n)*(</(html|HTML)>)$"
      }
    }
  }
}
