[
  {
    "modelicaFile": "FromModelica/MisplacedInfoWithParameter.mo",
    "within": "FromModelica",
    "topClassName": "FromModelica.MisplacedInfoWithParameter",
    "comment": "A block that places info section in parameter annotation",
    "public": {
      "parameters": [
        {
          "className": "Real",
          "type": "Real",
          "name": "kP",
          "value": "1",
          "comment": "Some comment",
          "unit": {
            "value": "\"1\""
          },
          "displayUnit": {
            "value": "\"1\""
          },
          "annotation": {
            "dialog": {
              "tab": "General",
              "group": "Parameters"
            }
          }
        }
      ]
    }
  }
]