[
  {
    "modelicaFile": "FromModelica/ParameterWithAttributes.mo",
    "within": "FromModelica",
    "topClassName": "FromModelica.ParameterWithAttributes",
    "comment": "Some class comment",
    "public": {
      "parameters": [
        {
          "className": "Real",
          "name": "kP",
          "value": "1",
          "comment": "Some comment",
          "unit": {
            "value": "\"Pa\"",
            "isFinal": false
          },
          "quantity": {
            "value": "\"PressureDifference\"",
            "isFinal": false
          },
          "min": {
            "value": "0",
            "isFinal": false
          },
          "max": {
            "value": "2",
            "isFinal": false
          },
          "nominal": {
            "value": "0.5",
            "isFinal": false
          },
          "start": {
            "value": "0.2",
            "isFinal": false
          },
          "fixed": {
            "value": "false",
            "isFinal": false
          },
          "stateSelect": {
            "value": "StateSelect.default",
            "isFinal": false
          },
          "annotation": {
            "dialog": {
              "tab": "General",
              "group": "Parameters"
            }
          }
        }
      ]
    },
    "info": "<html>\n<p>\nThis is the info section.\n</p>\n</html>"
  }
]