[
  {
    "modelicaFile": "FromModelica/package.mo",
    "within": "",
    "topClassName": "FromModelica",
    "comment": "Package with test models",
    "public": {
      "models": [
        {
          "className": "Integer",
          "name": "one",
          "value": "1",
          "comment": "An integer constant with value 1"
        }
      ]
    }
  }
]
