[
  {
    "modelicaFile": "./BlockInputOutput.mo",
    "within": "FromModelica",
    "topClassName": "FromModelica.BlockInputOutput",
    "comment": "A block with an input and an output signal",
    "public": {
      "inputs": [
        {
          "name": "u",
          "comment": "Input connector",
          "className": "Buildings.Controls.OBC.CDL.Interfaces.RealInput"
        }
      ],
      "outputs": [
        {
          "name": "y",
          "comment": "Output connector",
          "className": "Buildings.Controls.OBC.CDL.Interfaces.RealOutput"
        }
      ]
    }
  }
]