[
  {
    "modelicaFile": "FromModelica/ParameterWithInfo.mo",
    "within": "FromModelica",
    "topClassName": "FromModelica.ParameterWithInfo",
    "comment": "Some class comment",
    "public": {
      "parameters": [
        {
          "className": "Real",
          "type": "Real",
          "name": "kP",
          "value": "1",
          "comment": "Some comment",
          "unit": {
            "value": "\"1\""
          },
          "displayUnit": {
            "value": "\"1\""
          },
          "annotation": {
            "dialog": {
              "tab": "General",
              "group": "Parameters"
            }
          }
        }
      ]
    },
    "info": "<html>\n<p>\nThis is the info section.\n</p>\n</html>"
  }
]