[
  {
    "modelicaFile": "FromModelica/Parameter1WithVendorAnnotation.mo",
    "within": "FromModelica",
    "topClassName": "FromModelica.Parameter1WithVendorAnnotation",
    "comment": "Some class comment",
    "public": {
      "parameters": [
        {
          "className": "Real",
          "type": "Real",
          "name": "kP",
          "value": "1",
          "comment": "Some comment",
          "unit": {
            "value": "\"1\""
          },
          "displayUnit": {
            "value": "\"1\""
          },
          "annotation": {
            "dialog": {
              "tab": "General",
              "group": "Parameters"
            },
            "__cdl": {
              "haystack": {
                "dis": "site",
                "area": "400"
              },
              "brick": "xxxxx",
              "point": "digital"
            }
          }
        }
      ]
    }
  }
]