[
  {
    "modelicaFile": "FromModelica/BlockInputOutput.mo",
    "within": "FromModelica",
    "topClassName": "FromModelica.BlockInputOutput",
    "comment": "A block with an input and an output signal",
    "public": {
      "inputs": [
        {
          "className": "Buildings.Controls.OBC.CDL.Interfaces.RealInput",
          "name": "u",
          "comment": "Input connector",
          "placement": {
            "transformation": {
              "extent": [
                {
                  "x1": -140,
                  "x2": -20
                },
                {
                  "x1": -100,
                  "x2": 20
                }
              ]
            },
            "iconTransformation": {
              "extent": [
                {
                  "x1": -140,
                  "x2": -20
                },
                {
                  "x1": -100,
                  "x2": 20
                }
              ]
            }
          }
        }
      ],
      "outputs": [
        {
          "className": "Buildings.Controls.OBC.CDL.Interfaces.RealOutput",
          "name": "y",
          "comment": "Output connector",
          "placement": {
            "transformation": {
              "extent": [
                {
                  "x1": 100,
                  "x2": -10
                },
                {
                  "x1": 120,
                  "x2": 10
                }
              ]
            }
          }
        }
      ]
    }
  }
]