[
  {
    "modelicaFile": "FromModelica/Parameter2.mo",
    "within": "FromModelica",
    "topClassName": "FromModelica.Parameter2",
    "comment": "Some class comment",
    "public": {
      "parameters": [
        {
          "className": "Real",
          "type": "Real",
          "name": "myPar1",
          "value": "1",
          "comment": "Some comment",
          "unit": {
            "value": "\"1\""
          },
          "displayUnit": {
            "value": "\"1\""
          },
          "annotation": {
            "dialog": {
              "tab": "General",
              "group": "Parameters"
            }
          }
        },
        {
          "className": "Real",
          "type": "Real",
          "name": "myParNoValue",
          "comment": "Some comment",
          "unit": {
            "value": "\"1\""
          },
          "displayUnit": {
            "value": "\"1\""
          },
          "annotation": {
            "dialog": {
              "tab": "General",
              "group": "Parameters"
            }
          }
        },
        {
          "className": "Real",
          "type": "Real",
          "name": "myParMin",
          "comment": "Some comment",
          "unit": {
            "value": "\"1\""
          },
          "displayUnit": {
            "value": "\"1\""
          },
          "min": {
            "value": "0"
          },
          "modifications": [
            {
              "value": "0",
              "isFinal": false
            }
          ],
          "annotation": {
            "dialog": {
              "tab": "General",
              "group": "Parameters"
            }
          }
        },
        {
          "className": "Real",
          "type": "Real",
          "name": "myParMax",
          "comment": "Some comment",
          "unit": {
            "value": "\"1\""
          },
          "displayUnit": {
            "value": "\"1\""
          },
          "max": {
            "value": "0"
          },
          "modifications": [
            {
              "value": "0",
              "isFinal": false
            }
          ],
          "annotation": {
            "dialog": {
              "tab": "General",
              "group": "Parameters"
            }
          }
        },
        {
          "className": "Real",
          "type": "Real",
          "name": "myParUnit",
          "comment": "Some comment",
          "unit": {
            "value": "\"1\""
          },
          "displayUnit": {
            "value": "\"1\""
          },
          "modifications": [
            {
              "value": "\"K\"",
              "isFinal": false
            }
          ],
          "annotation": {
            "dialog": {
              "tab": "General",
              "group": "Parameters"
            }
          }
        },
        {
          "className": "Real",
          "type": "Real",
          "name": "myParInGroup",
          "comment": "Some comment",
          "unit": {
            "value": "\"1\""
          },
          "displayUnit": {
            "value": "\"1\""
          },
          "annotation": {
            "dialog": {
              "group": "Gains",
              "tab": "General"
            }
          }
        },
        {
          "className": "Real",
          "type": "Real",
          "name": "myParInTab",
          "comment": "Some comment",
          "unit": {
            "value": "\"1\""
          },
          "displayUnit": {
            "value": "\"1\""
          },
          "annotation": {
            "dialog": {
              "tab": "Initialization tab",
              "group": "Parameters"
            }
          }
        },
        {
          "className": "Real",
          "type": "Real",
          "name": "myParInTabInGroup1",
          "comment": "Some comment 1",
          "unit": {
            "value": "\"1\""
          },
          "displayUnit": {
            "value": "\"1\""
          },
          "annotation": {
            "dialog": {
              "tab": "Initialization tab",
              "group": "Initial state"
            }
          }
        },
        {
          "className": "Real",
          "type": "Real",
          "name": "myParInTabInGroup2",
          "comment": "Some comment 2",
          "unit": {
            "value": "\"1\""
          },
          "displayUnit": {
            "value": "\"1\""
          },
          "annotation": {
            "dialog": {
              "tab": "Initialization tab",
              "group": "Initial state"
            }
          }
        }
      ]
    }
  }
]