[
  {
    "modelicaFile": "./ExtendsClause-3.mo",
    "within": "FromModelica",
    "topClassName": "FromModelica.ExtendsClause",
    "comment": "model with extends clause",
    "public": {
      "parameters": [
        {
          "name": "length",
          "comment": "Length of the pipe",
          "annotation": {
            "dialog": {
              "tab": "General",
              "group": "Parameters"
            }
          },
          "className": "Modelica.SIunits.Length"
        }
      ],
      "models": [
        {
          "prefix": "extends",
          "name": "Buildings.Controls.OBC.CDL.Constants",
          "within": "FromModelica",
          "className": "Buildings.Controls.OBC.CDL.Constants"
        },
        {
          "prefix": "extends",
          "name": "Buildings.Controls.OBC.CDL.Logical.TrueHoldWithReset",
          "modifications": [
            {
              "name": "duration",
              "value": "300",
              "isFinal": true
            }
          ],
          "within": "FromModelica",
          "className": "Buildings.Controls.OBC.CDL.Logical.TrueHoldWithReset"
        },
        {
          "name": "gain",
          "comment": "Constant gain",
          "modifications": [
            {
              "name": "k",
              "value": "k",
              "isFinal": true
            }
          ],
          "within": "FromModelica",
          "className": "Buildings.Controls.OBC.CDL.Continuous.Gain"
        }
      ]
    },
    "protected": {
      "parameters": [
        {
          "name": "ARound",
          "value": "dh^2*Modelica.Constants.pi/4",
          "comment": "Cross sectional area (assuming a round cross section area)",
          "annotation": {
            "dialog": {
              "tab": "General",
              "group": "Parameters"
            }
          },
          "className": "Modelica.SIunits.Area"
        }
      ]
    },
    "info": "<html>\ntest...test...test...test...test...\n</html>"
  }
]